title,content,author,creationDate,movieTitle
Title 5,Mefaqxpw Njilimhr Sruuhjgc Bxestjwd Mdcfllig Ffipppel ,Rochelle Sagar,12/29/2017,MOVIE TITLE BLABLABLA 3
Title 4,Berpbpbk Pxpouobg Dnwcbbzo Dlfmishz Kngkjerv Ulaietoo ,Dora Fant,02/04/2018,MOVIE TITLE BLABLABLA 3
Title 1,Autnssjd Hvmqnoqj Ihcbiium Ifjapmce Fmcgnjns Rgcajtji ,Vanya Dyott,02/06/2018,MOVIE TITLE BLABLABLA 4
Title 7,Vdpnfdft Bdjkmfen Fgrspbdj Rfemlqcy Lsxwyiun Dvzhelut ,Linzy Gillcrist,12/06/2017,MOVIE TITLE BLABLABLA 8
Title 9,Fobmkknp Etwylcgc Rcvkpcht Fciqkcmf Eaeqiqtw Llksunjx ,Jacquelin Fyall,10/13/2018,MOVIE TITLE BLABLABLA 8
Title 8,Fezlpgvb Tdsimkkk Zrhjcumg Syniukrk Batlheao Fktzgipv ,Othilia Yarwood,04/11/2018,MOVIE TITLE BLABLABLA 1
Title 0,Qnfotnch Glerybdu Oqizfwlb Ozrxrsna Zialqfmk Jrewtxsr ,Floria Meneely,11/12/2017,MOVIE TITLE BLABLABLA 7
Title 0,Klwkzahe Jdxatmql Aiucrncn Ptrsojxi Gpsgboip Twijfqkk ,Timotheus Bernhardi,04/29/2018,MOVIE TITLE BLABLABLA 7
Title 4,Vktcreoh Ictlwlvg Luuezkvj Cewurmio Hhcspbgg Xgxwswws ,Eden Caslake,05/04/2018,MOVIE TITLE BLABLABLA 4
Title 2,Njltgocz Xmuxsljx Ammxsxzo Yyrjxcvn Knvsxbtz Kojxjbbo ,Colene Gibbens,06/16/2018,MOVIE TITLE BLABLABLA 9
Title 9,Srswzscp Ijawzwnl Odwkwqhq Cvalikkm Actnlmej Baakmfql ,Suzy Grealey,04/11/2018,MOVIE TITLE BLABLABLA 8
Title 1,Ckhoocfi Hpjsuarn Celiiank Aaypeidn Yyswrdze Qyjcunid ,Morganne Jilkes,05/17/2018,MOVIE TITLE BLABLABLA 7
Title 8,Vwfwjfqu Sesifzvk Woyzrmqv Mrbgrrmw Urcxwvyr Uswjwkvo ,Jeanette Cocozza,11/28/2017,MOVIE TITLE BLABLABLA 3
Title 5,Mqecifqw Eqoryiop Wfyrzsms Qgrbauwo Dquggioy Fvrynkyb ,Ansell Gainsboro,08/26/2018,MOVIE TITLE BLABLABLA 5
Title 3,Ehoeonme Kzktzizu Kzaxxsef Wtrvvinz Hlewmeat Ixqgccpf ,Gerri Bisley,12/04/2017,MOVIE TITLE BLABLABLA 7
Title 4,Xdgxjoez Nsoenuib Iqsraoss Jnmgpmee Nlphtkgs Mjfxpvfb ,Mela Bridgens,11/14/2017,MOVIE TITLE BLABLABLA 0
Title 3,Hcfnqicx Lmdnemah Bvwdfxsp Cbfhhgqd Xroicnfu Tgcgwxma ,Brenna Saban,06/06/2018,MOVIE TITLE BLABLABLA 7
Title 9,Qflgzzzl Ztaqikun Nusncjin Vctkkqww Cpqoxxpb Dvidjbcl ,Regan Fairhall,01/22/2018,MOVIE TITLE BLABLABLA 2
Title 7,Rilfraky Cexwecij Zxdbbyur Ipdhhwak Ginlmukb Simoudmw ,Clay Lochead,08/23/2018,MOVIE TITLE BLABLABLA 5
Title 0,Fyqwvwau Hfvahtcr Fpxtlmyf Sunamypg Bytxmesa Jkvkrogr ,Pieter Biner,01/09/2018,MOVIE TITLE BLABLABLA 8